{"schema_version":"1.0","report_id":"report-1","created_at":"2026-09-22T12:00:00Z","trial_count":0,"observations_total":0,"evidence_bundle_valid_total":0,"evidence_bundle_invalid_total":0,"decisions_total":0,"admit_read_total":0,"deny_total":0,"binding_mismatch_total":0,"sensitive_path_denied_total":0,"invalid_contract_total":0,"human_intervention_required_total":0,"decision_latency_ms":{"count":0,"sum":0,"min":null,"max":null},"provenance":{"aggregator_version":"1.0","kind":"local_evidence_trial_metrics"},"verification":{"verification_version":"1.0","canonicalization":"json-c14n-v1","report_sha256":"8cbd975b05d75cd4e1ea73f18480d12e9c03699b4e1ae3b4ac2ac59b4cbe970b"}}
